tcpdump: WARNING: any: That device doesn't support promiscuous mode
(Promiscuous mode not supported on the "any" device)
tcpdump: verbose output suppressed, use -v[v]... for full protocol decode
listening on any, link-type LINUX_SLL2 (Linux cooked v2), snapshot length 262144 bytes
01:25:23.851356 enp0s8 In  IP 10.10.2.10.44618 > 10.20.2.2.22: Flags [S], seq 159422692, win 64240, options [mss 1460,sackOK,TS val 2089384164 ecr 0,nop,wscale 7], length 0
01:25:23.851397 enp0s9 Out IP 10.10.2.10.44618 > 10.20.2.2.22: Flags [S], seq 159422692, win 64240, options [mss 1460,sackOK,TS val 2089384164 ecr 0,nop,wscale 7], length 0
01:25:23.852550 enp0s9 In  IP 10.20.2.2.22 > 10.10.2.10.44618: Flags [S.], seq 508960295, ack 159422693, win 65160, options [mss 1460,sackOK,TS val 2500273594 ecr 2089384164,nop,wscale 7], length 0
01:25:23.852573 enp0s8 Out IP 10.20.2.2.22 > 10.10.2.10.44618: Flags [S.], seq 508960295, ack 159422693, win 65160, options [mss 1460,sackOK,TS val 2500273594 ecr 2089384164,nop,wscale 7], length 0
01:25:23.853547 enp0s8 In  IP 10.10.2.10.44618 > 10.20.2.2.22: Flags [.], ack 1, win 502, options [nop,nop,TS val 2089384166 ecr 2500273594], length 0
01:25:23.853573 enp0s9 Out IP 10.10.2.10.44618 > 10.20.2.2.22: Flags [.], ack 1, win 502, options [nop,nop,TS val 2089384166 ecr 2500273594], length 0
01:25:23.854848 enp0s8 In  IP 10.10.2.10.44618 > 10.20.2.2.22: Flags [P.], seq 1:42, ack 1, win 502, options [nop,nop,TS val 2089384167 ecr 2500273594], length 41: SSH: SSH-2.0-OpenSSH_10.0p2 Debian-7+deb13u4
01:25:23.854880 enp0s9 Out IP 10.10.2.10.44618 > 10.20.2.2.22: Flags [P.], seq 1:42, ack 1, win 502, options [nop,nop,TS val 2089384167 ecr 2500273594], length 41: SSH: SSH-2.0-OpenSSH_10.0p2 Debian-7+deb13u4
01:25:23.855680 enp0s9 In  IP 10.20.2.2.22 > 10.10.2.10.44618: Flags [.], ack 42, win 509, options [nop,nop,TS val 2500273597 ecr 2089384167], length 0
01:25:23.855703 enp0s8 Out IP 10.20.2.2.22 > 10.10.2.10.44618: Flags [.], ack 42, win 509, options [nop,nop,TS val 2500273597 ecr 2089384167], length 0
10 packets captured
88 packets received by filter
0 packets dropped by kernel
